{
  "schema_version": 1,
  "name": "chrome_152_macos_capture_experimental",
  "notes": [
    "Imported from a single tls.peet.ws capture. Extension order is fixed to that sample, not a browser's complete randomized ordering policy.",
    "IP addresses, capture metadata, request header values, SNI, randoms, session IDs, key material and ECH ciphertext were removed; dynamic TLS values are generated per connection.",
    "GREASE extension bodies follow uTLS's BoringSSL behavior: first empty, second one zero byte; the capture does not expose their lengths.",
    "This is an experimental Chrome/152 capture profile, not a claim of complete Chrome 152 handshake or connection behavior support.",
    "Extension 51764 (0xca34) is TLS Trust Anchor IDs trust_anchors. This profile explicitly replays its captured advertisement, without implementing certificate selection or retry semantics.",
    "Signature algorithms 0x0904, 0x0905 and 0x0906 are advertised but not implemented by uTLS v1.8.2; negotiation of these algorithms fails."
  ],
  "tls": {
    "min_version": 771,
    "max_version": 772,
    "cipher_suites": [
      2570,
      4865,
      4866,
      4867,
      49195,
      49199,
      49196,
      49200,
      52393,
      52392,
      49171,
      49172,
      156,
      157,
      47,
      53
    ],
    "extensions": [
      {
        "type": "grease"
      },
      {
        "type": "raw",
        "id": 51764,
        "data_hex": "00b804d679090508839a648c9b2d011204d679090604d679090804d679090b0582df13020d08839a648c9b2d010d08839a648c9b2d010b0582df1302010582df13020e0582df13020f0582df13021404d679090c08839a648c9b2d010708839a648c9b2d010a0582df13021204d679090f0582df13020608839a648c9b2d010c04d679090408839a648c9b2d010904d679090104d679090a04d679090d08839a648c9b2d01130582df13021308839a648c9b2d010804d6790907",
        "allow_opaque": true
      },
      {
        "type": "session_ticket"
      },
      {
        "type": "key_share",
        "values": [
          2570,
          4588,
          29
        ]
      },
      {
        "type": "server_name"
      },
      {
        "type": "renegotiation_info"
      },
      {
        "type": "signature_algorithms",
        "values": [
          2570,
          2308,
          2309,
          2310,
          1027,
          2052,
          1025,
          1283,
          2053,
          1281,
          2054,
          1537
        ],
        "allow_unsupported": true
      },
      {
        "type": "status_request"
      },
      {
        "type": "grease_ech",
        "payload_lengths": [
          128
        ]
      },
      {
        "type": "ec_point_formats",
        "values": [
          0
        ]
      },
      {
        "type": "supported_versions",
        "values": [
          2570,
          772,
          771
        ]
      },
      {
        "type": "application_settings_new",
        "protocols": [
          "h2"
        ]
      },
      {
        "type": "supported_groups",
        "values": [
          2570,
          4588,
          29,
          23,
          24
        ]
      },
      {
        "type": "extended_master_secret"
      },
      {
        "type": "compress_certificate",
        "values": [
          2
        ]
      },
      {
        "type": "alpn",
        "protocols": [
          "h2",
          "http/1.1"
        ]
      },
      {
        "type": "sct"
      },
      {
        "type": "psk_key_exchange_modes",
        "values": [
          1
        ]
      },
      {
        "type": "grease"
      }
    ]
  },
  "http2": {
    "settings": [
      {
        "id": 1,
        "value": 65536
      },
      {
        "id": 2,
        "value": 0
      },
      {
        "id": 4,
        "value": 6291456
      },
      {
        "id": 6,
        "value": 262144
      }
    ],
    "connection_window_update": 15663105,
    "pseudo_header_order": [
      ":method",
      ":authority",
      ":scheme",
      ":path"
    ],
    "header_priority": {
      "stream_dep": 0,
      "exclusive": true,
      "weight": 256
    }
  }
}
